{"$schema":"https://json-schema.org/draft/2020-12/schema","title":"PipelineIRV1","type":"object","additionalProperties":false,"required":["version","project_id","source_refs","intent_ref","jobs","artifacts","quality_gates"],"properties":{"version":{"const":"1.0"},"project_id":{"type":"string","minLength":1},"source_refs":{"type":"array","items":{"type":"string"}},"intent_ref":{"type":"string"},"jobs":{"type":"array","items":{"$ref":"#/$defs/job"}},"artifacts":{"type":"array","items":{"$ref":"#/$defs/artifact"}},"quality_gates":{"type":"array","items":{"$ref":"#/$defs/gate"}}},"$defs":{"job":{"type":"object","additionalProperties":false,"required":["job_id","kind","needs","input_refs","output_refs","requirements","status","attempts","evidence_refs"],"properties":{"job_id":{"type":"string"},"kind":{"enum":["ingest","transcribe","direct","edit","motion","image_generate","video_generate","voice","music","avatar","assemble","qa","export"]},"needs":{"type":"array","items":{"type":"string"}},"input_refs":{"type":"array","items":{"type":"string"}},"output_refs":{"type":"array","items":{"type":"string"}},"time_range":{"type":["object","null"],"properties":{"start":{"type":"number","minimum":0},"end":{"type":"number","minimum":0}},"required":["start","end"]},"intent_refs":{"type":"array","items":{"type":"string"}},"requirements":{"type":"object","required":["capabilities"],"properties":{"capabilities":{"type":"array","items":{"type":"string"}},"editable_output":{"type":"boolean"}}},"preferred_provider":{"type":["string","null"]},"fallback_providers":{"type":"array","items":{"type":"string"}},"status":{"enum":["planned","ready","running","succeeded","failed","blocked","review_required","skipped"]},"attempts":{"type":"array"},"evidence_refs":{"type":"array","items":{"type":"string"}}}},"artifact":{"type":"object","required":["artifact_id","kind","uri","producer_job","qa_status"],"properties":{"artifact_id":{"type":"string"},"kind":{"type":"string"},"uri":{"type":"string"},"checksum":{"type":["string","null"]},"producer_job":{"type":"string"},"provider":{"type":["string","null"]},"intent_refs":{"type":"array","items":{"type":"string"}},"qa_status":{"enum":["pending","pass","fail","warning"]},"metadata":{"type":"object"}}},"gate":{"type":"object","required":["gate_id","kind","status"],"properties":{"gate_id":{"type":"string"},"kind":{"type":"string"},"status":{"enum":["pending","pass","fail","warning"]},"evidence_refs":{"type":"array","items":{"type":"string"}}}}}}