{"version":"1.0","project_id":"real-media-vertical-slice-001","source_refs":["input:source-video"],"intent_ref":"state:director-ir","jobs":[{"job_id":"ingest-001","kind":"ingest","needs":[],"input_refs":["input:source-video"],"output_refs":["artifact:normalized-source","evidence:source-probe"],"requirements":{"capabilities":["media_probe"]},"preferred_provider":"ffmpeg","fallback_providers":[],"status":"planned","attempts":[],"evidence_refs":[]},{"job_id":"direct-001","kind":"direct","needs":["ingest-001"],"input_refs":["artifact:normalized-source"],"output_refs":["state:director-ir","state:motion-ir","evidence:director-qa"],"requirements":{"capabilities":["perception","semantic_direction","director_ir","intent_qa"]},"preferred_provider":"ai-director-engine","fallback_providers":[],"status":"planned","attempts":[],"evidence_refs":[]},{"job_id":"edit-001","kind":"edit","needs":["direct-001"],"input_refs":["artifact:normalized-source","state:director-ir"],"output_refs":["artifact:rough-cut"],"intent_refs":["state:director-ir"],"requirements":{"capabilities":["transcript_edit"],"editable_output":false},"preferred_provider":"ffmpeg","fallback_providers":[],"status":"planned","attempts":[],"evidence_refs":[]},{"job_id":"motion-001","kind":"motion","needs":["edit-001"],"input_refs":["artifact:rough-cut","state:motion-ir"],"output_refs":["artifact:motion-render"],"intent_refs":["state:director-ir"],"requirements":{"capabilities":["motion_graphics","video_layer","audio_layer","deterministic_render"]},"preferred_provider":"motion-runtime-remotion","fallback_providers":[],"status":"planned","attempts":[],"evidence_refs":[]},{"job_id":"qa-001","kind":"qa","needs":["motion-001"],"input_refs":["artifact:motion-render"],"output_refs":["evidence:media-qa"],"requirements":{"capabilities":["media_probe"]},"preferred_provider":"ffmpeg","fallback_providers":[],"status":"planned","attempts":[],"evidence_refs":[]},{"job_id":"export-001","kind":"export","needs":["qa-001"],"input_refs":["artifact:motion-render","evidence:media-qa"],"output_refs":["artifact:final-video"],"requirements":{"capabilities":["assemble"]},"preferred_provider":"ffmpeg","fallback_providers":[],"status":"planned","attempts":[],"evidence_refs":[]}],"artifacts":[],"quality_gates":[{"gate_id":"director-intent","kind":"director_intent_qa","status":"pending","evidence_refs":["evidence:director-qa"]},{"gate_id":"media-streams","kind":"video_audio_probe","status":"pending","evidence_refs":["evidence:media-qa"]}]}